<?xml version="1.0" encoding="UTF-8" ?>
<!--<Panels xmlns:xsi="http://www.w3.org/2001/XMLSchema-instance" xsi:noNamespaceSchemaLocation="Panels.xsd">-->
<Panels>
	<Panel mark="3НСг 72.29.32-5"> 
		<gab>
			<length> 7188.0 </length>
			<height> 2808.0 </height> 
		</gab>
		<windows> 
			<window> 
				<width>600.0</width>
				<height>1805.0</height> 
				<posi>
					<X>894.0</X>
					<Y>489.0</Y>
					<Z>0.0</Z>      
				</posi> 
			</window>
			<window>
				<width>1200.0</width>
				<height>1805.0</height>
				<posi>
					<X>1794.0</X>
					<Y>489.0</Y>
					<Z>0.0</Z>
				</posi> 
			</window>
			<window> 
				<width>600.0</width>
				<height>1805.0</height>
				<posi>
					<X>4494.0</X>
					<Y>489.0</Y>
					<Z>0.0</Z>
				</posi>
			</window>
			<window>
				<width>1200.0</width>
				<height>1805.0</height>
				<posi>
					<X>5394.0</X>
					<Y>489.0</Y>
					<Z>0.0</Z>
				</posi>
			</window>
		</windows> 
	</Panel>
	<Panel mark="3НСг 72.29.32-1"> 
		<gab>
			<length>7188.0</length>
			<height>2808.0</height> 
		</gab>
		<windows> 
			<window> 
				<width>1500.0</width>
				<height>1805.0</height>
				<posi>
					<X>894.0</X>
					<Y>489.0</Y>
					<Z>0.0</Z>
				</posi> 
			</window>
			<window>
				<width>1500.0</width>
				<height>1805.0</height>
				<posi>
					<X>4794.0</X>
					<Y>489.0</Y>
					<Z>0.0</Z>
				</posi>
			</window> 
		</windows>
	</Panel>
	<Panel mark="3НСг 72.29.32"> 
		<gab> 
			<length>7188.0</length>
			<height>2808.0</height> 
		</gab>
		<windows> 
			<window> 
				<width>1810.0</width>
				<height>1805.0</height>
				<posi>
					<X>889.0</X>
					<Y>489.0</Y>
					<Z>0.0</Z>
				</posi> 
			</window>
			<window> 
				<width>1800.0</width>        
				<height>1805.0</height>
				<posi>
					<X>4494.0</X>
					<Y>489.0</Y>
					<Z>0.0</Z>
				</posi>        
			</window> 
		</windows> 
	</Panel>
	<Panel mark="3НСг 72.29.32-16"> 
		<gab> 
			<length>7188.0</length>
			<height>2808.0</height>
		</gab>
		<windows> 
			<window> 
				<width>1500.0</width>
				<height>1805.0</height>
				<posi>
					<X>894.0</X>
					<Y>489.0</Y>
					<Z>0.0</Z>
				</posi> 
			</window>
			<window> 
				<width>1500.0</width>
				<height>1805.0</height>
				<posi>
					<X>4494.0</X>
					<Y>489.0</Y>
					<Z>0.0</Z>
				</posi> 
			</window> 
		</windows> 
	</Panel>  
</Panels>